{
  "schema_version": "verified-answer/v0.1",
  "answer_id": "answer.fixture-backed-001",
  "created_at": "2026-07-28T00:00:00Z",
  "outcome": "evidence-backed",
  "query": {
    "canonicalization_id": "dw-query/v0.1",
    "sha256": "ffffffffffffffffffffffffffffffffffffffffffffffffffffffffffffffff"
  },
  "corpus": {
    "release_id": "corpus-release.fixture-001",
    "manifest_sha256": "eeeeeeeeeeeeeeeeeeeeeeeeeeeeeeeeeeeeeeeeeeeeeeeeeeeeeeeeeeeeeeee"
  },
  "runtime": {
    "manifest_id": "runtime-assurance.fixture-001",
    "manifest_sha256": "dddddddddddddddddddddddddddddddddddddddddddddddddddddddddddddddd"
  },
  "applicability": {
    "jurisdiction": "fixture-jurisdiction",
    "use_class": "regulatory-reference",
    "system_types": [
      "fixture-system"
    ],
    "source_water_types": [
      "fixture-source-water"
    ]
  },
  "claim_refs": [
    {
      "claim_id": "claim.dbp.synthetic-limit",
      "page_id": "dbp.synthetic-limit",
      "review_payload_sha256": "aaaaaaaaaaaaaaaaaaaaaaaaaaaaaaaaaaaaaaaaaaaaaaaaaaaaaaaaaaaaaaaa"
    }
  ],
  "quote_refs": [
    {
      "quote_id": "quote.dbp.synthetic-limit",
      "page_id": "dbp.synthetic-limit",
      "span_sha256": "cccccccccccccccccccccccccccccccccccccccccccccccccccccccccccccccc"
    }
  ],
  "checks": [
    {
      "check_id": "schema",
      "version": "v0.1",
      "verdict": "pass",
      "subjects": [
        {
          "kind": "envelope",
          "id": "answer.fixture-backed-001"
        }
      ]
    },
    {
      "check_id": "corpus-release",
      "version": "v0.1",
      "verdict": "pass",
      "subjects": [
        {
          "kind": "envelope",
          "id": "answer.fixture-backed-001"
        }
      ]
    },
    {
      "check_id": "runtime-manifest",
      "version": "v0.1",
      "verdict": "pass",
      "subjects": [
        {
          "kind": "envelope",
          "id": "answer.fixture-backed-001"
        }
      ]
    },
    {
      "check_id": "coverage",
      "version": "v0.1",
      "verdict": "pass",
      "subjects": [
        {
          "kind": "envelope",
          "id": "answer.fixture-backed-001"
        }
      ]
    },
    {
      "check_id": "eligibility",
      "version": "v0.1",
      "verdict": "pass",
      "subjects": [
        {
          "kind": "page",
          "id": "dbp.synthetic-limit"
        }
      ]
    },
    {
      "check_id": "freshness",
      "version": "v0.1",
      "verdict": "pass",
      "subjects": [
        {
          "kind": "page",
          "id": "dbp.synthetic-limit"
        }
      ]
    },
    {
      "check_id": "claim-resolution",
      "version": "v0.1",
      "verdict": "pass",
      "subjects": [
        {
          "kind": "claim",
          "id": "claim.dbp.synthetic-limit"
        }
      ]
    },
    {
      "check_id": "applicability",
      "version": "v0.1",
      "verdict": "pass",
      "subjects": [
        {
          "kind": "claim",
          "id": "claim.dbp.synthetic-limit"
        }
      ]
    },
    {
      "check_id": "numeric-claim-tuple",
      "version": "v0.1",
      "verdict": "pass",
      "subjects": [
        {
          "kind": "claim",
          "id": "claim.dbp.synthetic-limit"
        }
      ]
    },
    {
      "check_id": "quote-resolution",
      "version": "v0.1",
      "verdict": "pass",
      "subjects": [
        {
          "kind": "quote",
          "id": "quote.dbp.synthetic-limit"
        }
      ]
    },
    {
      "check_id": "span-fidelity",
      "version": "v0.1",
      "verdict": "pass",
      "subjects": [
        {
          "kind": "quote",
          "id": "quote.dbp.synthetic-limit"
        }
      ]
    }
  ],
  "outcome_reasons": [],
  "renderer": {
    "template_set_version": "fixture-renderer/v0.1"
  },
  "integrity": {
    "mode": "validated",
    "canonicalization": "dw-answer-envelope/v0.1",
    "artifact_sha256": "1111111111111111111111111111111111111111111111111111111111111111"
  }
}
